{
  "protocol_version": "0.1",
  "project_root": "/workspace/example-project",
  "updated_at": "2026-06-20T12:00:00Z",
  "latest_session_id": "agent-001",
  "sessions": [
    {
      "protocol_version": "0.1",
      "session_id": "agent-001",
      "run_id": "agent-001",
      "kind": "agent_run",
      "status": "awaiting_llm_responses",
      "updated_at": "2026-06-20T12:00:00Z",
      "source_locale": "en-US",
      "target_locale": "zh-CN",
      "operating_mode": "greenfield_localization",
      "reference_policy": "style_only",
      "selected_source_files": ["app/src/main/res/values/strings.xml"],
      "run_directory": "localize-anything-output/agent-001",
      "artifacts": {
        "agent_summary": "localize-anything-output/agent-001/agent-summary.json",
        "session_index": ".localize-anything/sessions/index.json"
      },
      "routing": {
        "adapter_counts": { "core.android-strings": 1 },
        "ignored_path_count": 2
      },
      "summary": {
        "source_file_count": 1,
        "batch_count": 1
      },
      "child_runs": {},
      "next_actions": ["Save one response per batch, then rerun agent-run with --responses-dir."]
    }
  ]
}
